task 1-->


SQL> select * from citizen;

      C_ID C_NAME     C_HOME            AGE OCCUPATION      GENDER     SALARY
---------- ---------- ---------- ---------- --------------- ------ ----------
         1 Alice      Dhaka              25 Teacher         Male        50000
         2 Bob        Dhaka              56 Service         Male        60000
         3 Charlie    Ctg                71 Retired         Male        10000
         4 Erin       Ctg                13 Student         Female        500
         5 Dave       Dhaka              45 Service         Male        40000
         6 Faythe     Gazipur            54 Doctor          Female      55000
         7 Grace      Gazipur            65 Musician        Female       5000
         8 Ivan       Dhaka              56 Engineer        Male        60000
         9 Frank      Ctg                23 Student         Male         1000
        10 Micheal    Comilla            32 Teacher         Male        45000
        11 Niaj       Comilla            51 Farmer          Male        20000
        12 Heidi      Khulna             15 Student         Female       1500
        13 Ted        Ctg                25 Business        Male       100000
        14 Walter     Comilla            52 Doctor          Male        70000
        15 Victor     Gazipur            53 Teacher         Male        50000
        16 Judy       Dhaka              35 Musician        Female      50000
        17 Pat        Khulna             43 Service         Male        50000
        18 Olivia     Khulna             34 Service         Female      45000
        19 Trent      Ctg                16 Student         Male          500
        20 Peggy      Comilla            32 Business        Female     120000
        21 Wendy      Ctg                25 Musician        Female     100000
        22 Oscar      Gazipur            14 Student         Male          400
        23 Mallet     Dhaka              25 Engineer        Male        50000

23 rows selected.

task 2-->


SQL> select c_name, age , occupation from citizen;

C_NAME            AGE OCCUPATION
---------- ---------- ---------------
Alice              25 Teacher
Bob                56 Service
Charlie            71 Retired
Erin               13 Student
Dave               45 Service
Faythe             54 Doctor
Grace              65 Musician
Ivan               56 Engineer
Frank              23 Student
Micheal            32 Teacher
Niaj               51 Farmer
Heidi              15 Student
Ted                25 Business
Walter             52 Doctor
Victor             53 Teacher
Judy               35 Musician
Pat                43 Service
Olivia             34 Service
Trent              16 Student
Peggy              32 Business
Wendy              25 Musician
Oscar              14 Student
Mallet             25 Engineer

23 rows selected.

task 3 -->


SQL> select c_name from citizen where c_home = 'Dhaka';

C_NAME
----------
Alice
Bob
Dave
Ivan
Judy
Mallet

6 rows selected.

task 4-->


SQL> select * from citizen where salary > 45000;

      C_ID C_NAME     C_HOME            AGE OCCUPATION      GENDER     SALARY
---------- ---------- ---------- ---------- --------------- ------ ----------
         1 Alice      Dhaka              25 Teacher         Male        50000
         2 Bob        Dhaka              56 Service         Male        60000
         6 Faythe     Gazipur            54 Doctor          Female      55000
         8 Ivan       Dhaka              56 Engineer        Male        60000
        13 Ted        Ctg                25 Business        Male       100000
        14 Walter     Comilla            52 Doctor          Male        70000
        15 Victor     Gazipur            53 Teacher         Male        50000
        16 Judy       Dhaka              35 Musician        Female      50000
        17 Pat        Khulna             43 Service         Male        50000
        20 Peggy      Comilla            32 Business        Female     120000
        21 Wendy      Ctg                25 Musician        Female     100000
        23 Mallet     Dhaka              25 Engineer        Male        50000

12 rows selected.

task 5 -->


SQL> select c_name, c_home from citizen where age < 45;

C_NAME     C_HOME
---------- ----------
Alice      Dhaka
Erin       Ctg
Frank      Ctg
Micheal    Comilla
Heidi      Khulna
Ted        Ctg
Judy       Dhaka
Pat        Khulna
Olivia     Khulna
Trent      Ctg
Peggy      Comilla
Wendy      Ctg
Oscar      Gazipur
Mallet     Dhaka

14 rows selected.

task 6-->


SQL> select * from citizen where gender = 'Female';

      C_ID C_NAME     C_HOME            AGE OCCUPATION      GENDER     SALARY
---------- ---------- ---------- ---------- --------------- ------ ----------
         4 Erin       Ctg                13 Student         Female        500
         6 Faythe     Gazipur            54 Doctor          Female      55000
         7 Grace      Gazipur            65 Musician        Female       5000
        12 Heidi      Khulna             15 Student         Female       1500
        16 Judy       Dhaka              35 Musician        Female      50000
        18 Olivia     Khulna             34 Service         Female      45000
        20 Peggy      Comilla            32 Business        Female     120000
        21 Wendy      Ctg                25 Musician        Female     100000

8 rows selected.

task 7 -->


SQL> select * from citizen where occupation = 'Engineer' or occupation = 'Doctor' or occupation = 'Retired';

      C_ID C_NAME     C_HOME            AGE OCCUPATION      GENDER     SALARY
---------- ---------- ---------- ---------- --------------- ------ ----------
         3 Charlie    Ctg                71 Retired         Male        10000
         6 Faythe     Gazipur            54 Doctor          Female      55000
         8 Ivan       Dhaka              56 Engineer        Male        60000
        14 Walter     Comilla            52 Doctor          Male        70000
        23 Mallet     Dhaka              25 Engineer        Male        50000

task 8 -->



SQL> select c_id, c_name, salary from citizen where occupation in('Musician','Business');

      C_ID C_NAME         SALARY
---------- ---------- ----------
         7 Grace            5000
        13 Ted            100000
        16 Judy            50000
        20 Peggy          120000
        21 Wendy          100000

task 9 -->


SQL> select c_name from citizen where occupation = 'Doctor' or occupation = 'Engineer';

C_NAME
----------
Faythe
Ivan
Walter
Mallet

task 10-->


SQL> select salary from citizen where occupation = 'Doctor' order by salary asc;

    SALARY
----------
     55000
     70000

task 11-->


SQL> select c_name, age from citizen order by age desc, c_name asc;

C_NAME            AGE
---------- ----------
Charlie            71
Grace              65
Bob                56
Ivan               56
Faythe             54
Victor             53
Walter             52
Niaj               51
Dave               45
Pat                43
Judy               35
Olivia             34
Micheal            32
Peggy              32
Alice              25
Mallet             25
Ted                25
Wendy              25
Frank              23
Trent              16
Heidi              15
Oscar              14
Erin               13

23 rows selected.

task 12-->


SQL> select distinct c_home from citizen;

C_HOME
----------
Gazipur
Ctg
Comilla
Dhaka
Khulna

SQL> select c_home as  Unique_District from citizen;

UNIQUE_DIS
----------
Dhaka
Dhaka
Ctg
Ctg
Dhaka
Gazipur
Gazipur
Dhaka
Ctg
Comilla
Comilla
Khulna
Ctg
Comilla
Gazipur
Dhaka
Khulna
Khulna
Ctg
Comilla
Ctg
Gazipur
Dhaka

23 rows selected.

task 13-->


SQL> select c_name,salary*1.4 as salary from citizen where occupation != 'Retired';

C_NAME         SALARY
---------- ----------
Alice           70000
Bob             84000
Erin              700
Dave            56000
Faythe          77000
Grace            7000
Ivan            84000
Frank            1400
Micheal         63000
Niaj            28000
Heidi            2100
Ted            140000
Walter          98000
Victor          70000
Judy            70000
Pat             70000
Olivia          63000
Trent             700
Peggy          168000
Wendy          140000
Oscar             560
Mallet          70000

22 rows selected.

task 14-->


SQL> select c_name from citizen where gender = 'Male' and salary > 50000;

C_NAME
----------
Bob
Ivan
Ted
Walter

task 15-->



SQL> select * from citizen where salary between 30000 and 50000;

      C_ID C_NAME     C_HOME            AGE OCCUPATION      GENDER     SALARY
---------- ---------- ---------- ---------- --------------- ------ ----------
         1 Alice      Dhaka              25 Teacher         Male        50000
         5 Dave       Dhaka              45 Service         Male        40000
        10 Micheal    Comilla            32 Teacher         Male        45000
        15 Victor     Gazipur            53 Teacher         Male        50000
        16 Judy       Dhaka              35 Musician        Female      50000
        17 Pat        Khulna             43 Service         Male        50000
        18 Olivia     Khulna             34 Service         Female      45000
        23 Mallet     Dhaka              25 Engineer        Male        50000

8 rows selected.

task 16 -->


SQL> select salary from citizen where age not between 30 and 55;

    SALARY
----------
     50000
     60000
     10000
       500
      5000
     60000
      1000
      1500
    100000
       500
    100000
       400
     50000

13 rows selected.

task 17 -->


create table updated_citizen
(
c_id number,
name varchar2(12),
c_home varchar(22),
age number,
occupation varchar2(12),
gender varchar2(12),
new_salary number,
constraint updated_citizen primary key(c_id)
);
SQL> create table updated_citizen
  2  (
  3  c_id number,
  4  name varchar2(12),
  5  c_home varchar(22),
  6  age number,
  7  occupation varchar2(12),
  8  gender varchar2(12),
  9  new_salary number,
 10  constraint updated_citizen primary key(c_id)
 11  );

Table created.

INSERT INTO updated_citizen  VALUES (1, 'Alice', 'Dhaka', 25, 'Teacher', 'Male', 50000);
INSERT INTO updated_citizen  VALUES (2, 'Bob', 'Dhaka', 56, 'Service', 'Male', 60000);
INSERT INTO updated_citizen  VALUES (3, 'Charlie', 'Ctg', 71, 'Retired', 'Male', 10000);
INSERT INTO updated_citizen  VALUES (4, 'Erin', 'Ctg', 13, 'Student', 'Female', 500);
INSERT INTO updated_citizen  VALUES (5, 'Dave', 'Dhaka', 45, 'Service', 'Male', 40000);
INSERT INTO updated_citizen  VALUES (6, 'Faythe', 'Gazipur', 54, 'Doctor', 'Female', 55000);
INSERT INTO updated_citizen  VALUES (7, 'Grace', 'Gazipur', 65, 'Musician', 'Female', 5000);
INSERT INTO updated_citizen VALUES (8, 'Ivan', 'Dhaka', 56, 'Engineer', 'Male', 60000);
INSERT INTO updated_citizen  VALUES (9, 'Frank', 'Ctg', 23, 'Student', 'Male', 1000);
INSERT INTO updated_citizen  VALUES (10, 'Micheal', 'Comilla', 32, 'Teacher', 'Male', 45000);
INSERT INTO updated_citizen  VALUES (11, 'Niaj', 'Comilla', 51, 'Farmer', 'Male', 20000);
INSERT INTO updated_citizen  VALUES (12, 'Heidi', 'Khulna', 15, 'Student', 'Female', 1500);
INSERT INTO updated_citizen  VALUES (13, 'Ted', 'Ctg', 25, 'Business', 'Male', 100000);
INSERT INTO updated_citizen  VALUES (14, 'Walter', 'Comilla', 52, 'Doctor', 'Male', 70000);
INSERT INTO updated_citizen  VALUES (15, 'Victor', 'Gazipur', 53, 'Teacher', 'Male', 50000);
INSERT INTO updated_citizen  VALUES (16, 'Judy', 'Dhaka', 35, 'Musician', 'Female', 50000);
INSERT INTO updated_citizen VALUES (17, 'Pat', 'Khulna', 43, 'Service', 'Male', 50000);
INSERT INTO updated_citizen  VALUES (18, 'Olivia', 'Khulna', 34, 'Service', 'Female', 45000);
INSERT INTO updated_citizen  VALUES (19, 'Trent', 'Ctg', 16, 'Student', 'Male', 500);
INSERT INTO updated_citizen VALUES (20, 'Peggy', 'Comilla', 32, 'Business', 'Female', 120000);
INSERT INTO updated_citizen  VALUES (21, 'Wendy', 'Ctg', 25, 'Musician', 'Female', 100000);
INSERT INTO updated_citizen  VALUES (22, 'Oscar', 'Gazipur', 14, 'Student', 'Male', 400);
INSERT INTO updated_citizen  VALUES (23, 'Mallet', 'Dhaka', 25, 'Engineer', 'Male', 50000);

update updated_citizen set c_home = 'Cumilla' where c_home = 'Comilla';

SQL> update updated_citizen set c_home = 'Cumilla' where c_home = 'Comilla';

4 rows updated.

task 18 -->


delete from updated_citizen where c_id BETWEEN 1 AND 10;
SQL> delete from updated_citizen where c_id BETWEEN 1 AND 10;

10 rows deleted.


task 19-->


update updated_citizen set age = age+10, new_salary=new_salary*1.3;
SQL> update updated_citizen set age = age+10, new_salary=new_salary*1.3;

13 rows updated.

task 20-->


select c_name, salary, new_salary from citizen, updated_citizen where citizen.c_id = updated_citizen.c_id;

SQL> update updated_citizen set age = age+10, new_salary=new_salary*1.3;

13 rows updated.

SQL> select c_name, salary, new_salary from citizen, updated_citizen where citizen.c_id = updated_citizen.c_id;

C_NAME         SALARY NEW_SALARY
---------- ---------- ----------
Niaj            20000      26000
Heidi            1500       1950
Ted            100000     130000
Walter          70000      91000
Victor          50000      65000
Judy            50000      65000
Pat             50000      65000
Olivia          45000      58500
Trent             500        650
Peggy          120000     156000
Wendy          100000     130000
Oscar             400        520
Mallet          50000      65000

13 rows selected.


